{
  "schema_version": 1,
  "event_id": "evt_123",
  "event_seq": 1,
  "source": "local.test",
  "event": "example",
  "occurred_at": "2026-06-28T03:30:00.000Z",
  "origin": {
    "actor": "agent:clod",
    "kind": "agent"
  },
  "subject": {
    "type": "task",
    "id": "T-05198"
  },
  "payload": {
    "ok": true
  }
}
